{
  "$schema": "https://json-schema.org/draft/2020-12/schema",
  "$id": "https://internal.invalid/migration-skill-lab/verification-result.schema.json",
  "title": "Migration Verification Result",
  "type": "object",
  "additionalProperties": false,
  "required": [
    "schemaVersion",
    "artifactType",
    "skill",
    "skillVersion",
    "runId",
    "flowId",
    "status",
    "flowContract",
    "migrationResult",
    "criteria",
    "validation",
    "coverageDelta",
    "browserValidation",
    "manualValidation",
    "diagnosis",
    "push",
    "verificationAttempt"
  ],
  "properties": {
    "schemaVersion": { "const": 3 },
    "artifactType": { "const": "verification-result" },
    "skill": { "const": "verify-flow" },
    "skillVersion": {
      "type": "string",
      "pattern": "^\\d+\\.\\d+\\.\\d+$"
    },
    "runId": {
      "type": "string",
      "pattern": "^[a-z0-9]+(?:-[a-z0-9]+)*$"
    },
    "flowId": {
      "type": "string",
      "pattern": "^[a-z0-9]+(?:-[a-z0-9]+)*$"
    },
    "verificationAttempt": {
      "type": "integer",
      "minimum": 1
    },
    "status": {
      "type": "string",
      "enum": ["PASS", "FAIL", "BLOCKED"]
    },
    "flowContract": {
      "type": "object",
      "additionalProperties": false,
      "required": ["path", "sha256"],
      "properties": {
        "path": { "type": "string", "minLength": 1 },
        "sha256": {
          "type": "string",
          "pattern": "^[a-f0-9]{64}$"
        }
      }
    },
    "migrationResult": {
      "type": "object",
      "additionalProperties": false,
      "required": ["path", "sha256"],
      "properties": {
        "path": { "type": "string", "minLength": 1 },
        "sha256": {
          "type": "string",
          "pattern": "^[a-f0-9]{64}$"
        }
      }
    },
    "debugResult": {
      "type": "object",
      "additionalProperties": false,
      "required": ["path", "sha256"],
      "properties": {
        "path": { "type": "string", "minLength": 1 },
        "sha256": {
          "type": "string",
          "pattern": "^[a-f0-9]{64}$"
        }
      }
    },
    "criteria": {
      "type": "array",
      "minItems": 1,
      "items": {
        "type": "object",
        "additionalProperties": false,
        "required": ["scenarioId", "status", "evidence", "diagnosis"],
        "properties": {
          "scenarioId": {
            "type": "string",
            "pattern": "^[a-z0-9]+(?:-[a-z0-9]+)*$"
          },
          "status": {
            "type": "string",
            "enum": ["PASS", "FAIL", "BLOCKED"]
          },
          "evidence": {
            "type": "array",
            "items": { "type": "string", "minLength": 1 }
          },
          "diagnosis": { "type": "string", "minLength": 1 }
        }
      }
    },
    "validation": {
      "type": "array",
      "minItems": 1,
      "items": {
        "type": "object",
        "additionalProperties": false,
        "required": ["command", "status", "summary"],
        "properties": {
          "command": { "type": "string", "minLength": 1 },
          "status": {
            "type": "string",
            "enum": ["passed", "failed", "blocked", "not-run"]
          },
          "summary": { "type": "string", "minLength": 1 }
        }
      }
    },
    "coverageDelta": {
      "type": "object",
      "additionalProperties": false,
      "required": ["status", "summary"],
      "properties": {
        "status": {
          "type": "string",
          "enum": ["measured", "not-measured", "blocked"]
        },
        "summary": { "type": "string", "minLength": 1 }
      }
    },
    "manualValidation": {
      "type": "object",
      "additionalProperties": false,
      "required": ["status", "summary"],
      "properties": {
        "status": {
          "type": "string",
          "enum": ["passed", "failed", "blocked", "not-run"]
        },
        "summary": { "type": "string", "minLength": 1 }
      }
    },
    "browserValidation": {
      "type": "object",
      "additionalProperties": false,
      "required": ["status", "summary", "evidenceSource"],
      "properties": {
        "status": {
          "type": "string",
          "enum": ["passed", "failed", "blocked", "not-run"]
        },
        "summary": { "type": "string", "minLength": 1 },
        "evidenceSource": {
          "type": "string",
          "enum": ["real-host-layout", "isolated-fixture", "not-run"]
        }
      }
    },
    "diagnosis": {
      "type": "array",
      "items": { "type": "string", "minLength": 1 }
    },
    "push": {
      "type": "object",
      "additionalProperties": false,
      "required": [
        "policy",
        "status",
        "remote",
        "branch",
        "commitShas",
        "upstreamSet",
        "summary"
      ],
      "properties": {
        "policy": {
          "type": "string",
          "enum": ["confirm-after-pass", "never"]
        },
        "status": {
          "type": "string",
          "enum": ["not-requested", "declined", "pushed", "blocked"]
        },
        "remote": {
          "type": "string",
          "minLength": 1
        },
        "branch": {
          "type": "string",
          "minLength": 1
        },
        "commitShas": {
          "type": "array",
          "uniqueItems": true,
          "items": {
            "type": "string",
            "pattern": "^[a-f0-9]{7,64}$"
          }
        },
        "upstreamSet": {
          "type": "boolean"
        },
        "confirmedByRole": {
          "type": "string",
          "minLength": 1
        },
        "confirmedAt": {
          "type": "string",
          "pattern": "^\\d{4}-\\d{2}-\\d{2}T\\d{2}:\\d{2}:\\d{2}(?:\\.\\d+)?Z$"
        },
        "summary": {
          "type": "string",
          "minLength": 1
        }
      }
    }
  }
}
