{
  "schemaVersion": 3,
  "artifactType": "verification-result",
  "skill": "verify-flow",
  "skillVersion": "0.5.0",
  "runId": "demo-line-drawer-verification-001",
  "flowId": "demo-line-drawer",
  "verificationAttempt": 1,
  "status": "PASS",
  "flowContract": {
    "path": "examples\\handoff\\demo-line-drawer\\flow-contract.json",
    "sha256": "f3e564f84c4667b750d05137a210ac522f8c18871237788b9061cbe5a1fe3d8b"
  },
  "migrationResult": {
    "path": "examples\\handoff\\demo-line-drawer\\migration-result.json",
    "sha256": "e699642e952dc1319c114d443ea2ed8d7460f7a8571c2938e64ffb6f73e67d39"
  },
  "criteria": [
    {
      "scenarioId": "valid-edit",
      "status": "PASS",
      "evidence": [
        "Targeted test passed."
      ],
      "diagnosis": "No regression detected."
    }
  ],
  "validation": [
    {
      "command": "npm run test -- Drawer.test.ts",
      "status": "passed",
      "summary": "Targeted test passed."
    },
    {
      "command": "npm run typecheck",
      "status": "passed",
      "summary": "Typecheck passed."
    },
    {
      "command": "npm run build",
      "status": "passed",
      "summary": "Build passed."
    }
  ],
  "coverageDelta": {
    "status": "measured",
    "summary": "The selected flow is covered by the targeted test."
  },
  "manualValidation": {
    "status": "passed",
    "summary": "The representative host scenario passed."
  },
  "browserValidation": {
    "status": "passed",
    "summary": "The selected-line browser scenario passed.",
    "evidenceSource": "real-host-layout"
  },
  "diagnosis": [],
  "push": {
    "policy": "confirm-after-pass",
    "status": "pushed",
    "remote": "origin",
    "branch": "feature/migrate-detail-drawer",
    "commitShas": [
      "abcdef1234567890abcdef1234567890abcdef12"
    ],
    "upstreamSet": true,
    "confirmedByRole": "implementer",
    "confirmedAt": "2026-09-07T09:00:00Z",
    "summary": "The verified feature branch was pushed after explicit confirmation."
  }
}
